<?xml version="1.0" encoding="utf-8"?>
<Project xmlns:xsi="http://www.w3.org/2001/XMLSchema-instance" xsi:noNamespaceSchemaLocation="ProceduresToMap.xsd">
  <NameSpace>Test</NameSpace>
  <RecordSets>
	  <RecordSet>
      <Name>User</Name>
      <UpdateStoredProcedure>
        <Command>
          <Owner>dbo</Owner>
          <Name>aposa_SetUserData</Name>          
        </Command>
        <ExcludedFromRules>UserID</ExcludedFromRules>
      </UpdateStoredProcedure>
      <SelectStoredProcedure>
        <Command>
          <Owner>dbo</Owner>
          <Name>aposa_GetUserData</Name>
        </Command>
        <ExcludedFromRules></ExcludedFromRules>
      </SelectStoredProcedure>
      <SelectCollectionStoredProcedure>
        <Command>
          <Owner>dbo</Owner>
          <Name>aposa_GetUsersData</Name>
        </Command>
        <ExcludedFromRules></ExcludedFromRules>
      </SelectCollectionStoredProcedure>
    </RecordSet>
    <RecordSet>
      <Name>Product</Name>
      <UpdateStoredProcedure>
        <Command>
          <Owner>dbo</Owner>
          <Name>aposa_SetProductData</Name>          
        </Command>
        <ExcludedFromRules>ProductID</ExcludedFromRules>
      </UpdateStoredProcedure>
      <SelectStoredProcedure>
        <Command>
          <Owner>dbo</Owner>
          <Name>aposa_GetProductData</Name>
        </Command>
        <ExcludedFromRules></ExcludedFromRules>
      </SelectStoredProcedure>
      <SelectCollectionStoredProcedure>
        <Command>
          <Owner>dbo</Owner>
          <Name>aposa_GetProductsData</Name>
        </Command>
        <ExcludedFromRules></ExcludedFromRules>
      </SelectCollectionStoredProcedure>
    </RecordSet>
  </RecordSets>
</Project>
